Job Title,Company,Description
Consultant.e Junior – Casablanca - job post,Wavestone,Description de l entreprise   Wavestone est un cabinet de conseil  qui a pour mission d accompagner les entreprises et organisations dans leurs transformations stratégiques dans un monde en constante évolution  avec l ambition de générer des impacts positifs et durables pour toutes ses parties prenantes  Forts de plus de 5 500 collaborateurs talentueux et engagés à travers l Europe  l Amérique du Nord et l Asie  nous disposons d expertises sectorielles de premier plan et d un portefeuille de savoir faire cross sectoriels  nous permettant d adresser à 360  les grands programmes de transformation de nos clients  Chez Wavestone  nous sommes convaincus que la réussite professionnelle et l épanouissement personnel vont de pair  C est pourquoi nous offrons un environnement de travail stimulant  inclusif et bienveillant  où chacun peut s épanouir et atteindre son plein potentiel  Wavestone est coté sur Euronext  à Paris  et labellisé Great Place to Work   Pour plus d informations  consulter www wavestone com       Description du poste   Au sein d une équipe de près de 30 collaborateurs  vous accompagnerez nos clients dans leurs programmes de transformation   Par exemple  nous avons accompagné récemment    Une des plus grosses entreprises du Maroc dans la refonte de sa stratégie de distribution   Une grande banque dans sa transformation digitale en pilotant la transformation auprès de la direction générale  en refondant les processus de vente et l architecture des systèmes d information sous jacente   Une entreprise dans un programme de mise en place de synergies avec ses filiales   Encadré e  par des consultants expérimentés  vous serez susceptible d intervenir sur une grande diversité de clients et de problématiques  En tant que consultant junior  vous    Contribuez à la conduite de missions de diagnostic  de définition et de mise en œuvre d organisation  de processus  d outil avec le support de votre management ou d experts internationaux  Vos responsabilités couvrent à la fois la production de livrables  l animation d ateliers en autonomie  l appui de votre chef de projet  ainsi que la gestion quotidienne de la relation de votre client  Participez à la rédaction de propositions commerciales  et à la transformation des suites de missions  Dans un esprit   startup    vous aurez l opportunité avec les autres membres de l équipe de vous impliquer sur la communication  le knowledge management  le recrutement  l organisation et le bien être au bureau  etc        Qualifications        Diplômé e  d une grande école d ingénieur ou de management  idéalement à l étranger  vous êtes jeune diplômé e  ou vous justifiez d une première expérience  acquise dans un cabinet de conseil ou auprès d une grande entreprise  Votre expérience et votre curiosité intellectuelle  vous permettent de comprendre rapidement les spécificités de nos clients   Vous êtes doté e  d un esprit critique et analytique aiguisé  d un très bon relationnel et d un sens prononcé du service et de l excellence  Vous souhaitez intégrer des équipes à taille humaine favorisant la proximité et la transmission des savoirs  Vous recherchez un environnement de travail stimulant  propice à l épanouissement personnel au sein d un cabinet de conseil reconnu et en pleine croissance   Alors si votre objectif est de participer à un projet d entreprise ambitieux et de mettre à profit votre talent et votre enthousiasme dans une société qui saura vous faire grandir avec elle  donnez vous les chances de rejoindre nos équipes  
Administrateur de ventes - job post,AMSTERGI MOROCCO,Nous recherchons un Administrateur des Ventes motivé et rigoureux pour rejoindre notre équipe  Vous serez responsable de la gestion administrative des ventes  du suivi des commandes  de la coordination avec les clients et de la gestion des dossiers commerciaux  Type d emploi   Temps plein  CDI Rémunération   4 000 00DH à 5 000 00DH par mois
responsable de stock pour société de décoration H/F - job post,CRIT MAROC,Nous recrutons un responsable de stock pour une société de décoration  il sera lié directement au responsable de stock sénior  n 1  et à la directrice de boutique  Il reportera directement au dirigeant pour tous les cas particuliers Il travaillera en étroite collaboration avec le responsable de stock sénior  sur le même champ d action  Ils devront assurer entre eux les passations et se relayer en cas d absence  Le responsable de stock aura sous sa responsabilité la gestion de deux agents de stock qui lui reporteront directement et qui devront respecter toutes ses consignes  Missions   1  Opérations logistiques     Contrôler qualitativement et quantitativement les marchandises réceptionnées   Réceptionner pointer et superviser le déballage de toutes les livraisons  marchandises  packaging et fournitures    Assurer et gérer les transferts entre boutiques  les retours et livraisons d articles aux clients   Superviser la préparation des commandes    Assurer la protection et l emballage des articles dans le stock  lors des transferts interboutiques et des envois clients   Assurer le réassort quotidien des articles vendus et du packaging en collaboration avec la directrice de boutique   Assurer l approvisionnement des fournitures  du packaging et des denrées  eau   café etc   en fonction des besoins    Organiser et veiller au rangement des différentes zones du stock   Conserver un environnement propre et sécurisé dans son stock   Gérer les inventaires tournants et annuels y compris les bilans et rapprochements   Être en interaction avec la directrice de boutique pour optimiser la présentation des articles en magasin et faciliter ainsi les ventes    Mettre à jour et organiser les archives quotidiennement   Former les équipes aux nouvelles procédures 2  Opérations de Gestion Commerciale     Assurer une saisie exacte et rigoureuse des opérations sur le logiciel de Gestion commerciale   conformément aux procédures de l entreprise  o Devis  commandes  livraisons  factures  retours  avoirs o Règlements clients o Demandes de marchandises à la centrale o Saisie et contrôle des bons de retour à la centrale o Saisie et contrôle des bons de livraison aux autres boutiques du réseau   Suivre les ventes et les prévisions pour assurer la disponibilité constante des produits   Editer et transmettre à la direction régulièrement les états commerciaux 3  Operations de caisse      Avoir une maîtrise parfaite du Pack Office  Excel  et des outils de gestion des ventes internes à l entreprise  Pos   Cosmos    Tenir la caisse des recettes   Respecter les consignes du siège en matière d encaissement  de facturation client  de transfert de marchandise et de livraison client   Assurer le rapprochement de la recette en cours et en fin de journée    Assurer les ouvertures et clôtures de caisse   Gérer les versements à la banque    Transmettre quotidiennement à la comptabilité les feuilles de journées de caisse accompagnées des justificatifs bancaires de versement  Il a la responsabilité de la recette   Tenir la caisse des dépenses  petites fournitures et dépenses occasionnelles   Le responsable de stock est un véritable partenaire commercial qui collabore aux principales activités opérationnelles et commerciales  Il est le garant du maintien d un standard minium de tenue de stock dans un environnement de luxe  Il travaille en étroite collaboration avec la directrice de boutique et les commerciaux  C est le garant indirect du service client  Il doit s adapter rapidement aux situations d urgence et de période chargées imposées par son activité  Type d emploi   CDI Rémunération   8 000 00DH à 12 000 00DH par mois
CHARGE D'ACCUEIL H/F/X - job post,Société Générale,Vos missions au quotidien    Traiter les opérations au quotidien  caisse  virement  moyens de paiement        Orienter les clients vers l interlocuteur adéquat au sein de l agence  Placer certains produits de la banque et de la bancassurance dans une démarche de participation à la gestion commerciale de l agence Gérer et développer un portefeuille de clients mass Market  Produire et transmettre des Reportings  PV de caisse  réalisations       Vérifier et procéder à la sécurisation des valeurs  caisse  chéquiers  cachets  coffre fort           Et si c était vous      Métier   Techniques bancaires  Comptabilité Transverses   Procédures et réglementation bancaires  Aptitude commerciale  Bureautique et maîtrise du système d information de la banque Comportementales   Esprit d équipe  Engagement  Responsabilité     Pourquoi nous choisir     Chez Société Générale  nous sommes convaincus que les personnes sont moteurs du changement  et que le monde de demain sera fait de toutes leurs initiatives  des plus petites aux plus ambitieuses  Que vous nous rejoigniez pour quelques mois  quelques années ou toute votre carrière  ensemble nous avons les moyens d avoir un impact positif sur l avenir  Créer  oser  innover  entreprendre font partie de notre ADN  Si vous aussi vous souhaitez être dans l action  évoluer dans un environnement stimulant et bienveillant  vous sentir utile au quotidien et développer ou renforcer votre expertise  nous sommes faits pour nous rencontrer   Vous hésitez encore   Sachez que nos collaborateurs peuvent s engager quelques jours par an pour des actions de solidarité sur leur temps de travail   parrainer des personnes en difficulté dans leur orientation ou leur insertion professionnelle  participer à l éducation financière de jeunes en apprentissage ou encore partager leurs compétences avec une association  Les formats d engagement sont multiples         Diversité et inclusion         Nous sommes un employeur garantissant l égalité des chances et nous sommes fiers de faire de la diversité une force pour notre entreprise  Le groupe s engage à reconnaître et à promouvoir tous les talents  quels que soient leurs croyances  âge  handicap  origine ethnique  nationalité  appartenance à une organisation politique  religieuse  syndicale ou à une minorité  ou toute autre caractéristique qui pourrait faire l objet d une discrimination 
assistante anglophone séniore pour entreprise d'artisanat - job post,CRIT MAROC,Nous recrutons une assistante obligatoirement anglophone et obligatoirement disponible dans l immédiat sans activité professionnelle actuellement Missions  Accompagner la DG L organisation et la documentation des réunions  rendez vous et planification des déplacements  Gestion Administrative   Gestion de l agenda   Planification et organisation des rendez vous    Rédaction de documents   Rédiger des courriers  rapports et notes de service    Gestion des appels   Répondre aux appels téléphoniques et filtrer les communications    Gestion des e mails   Traiter et classer les courriels  Coordination de Projets   Organisation de réunions   Planification  préparation des agendas et prise de notes     Gestion des déplacements   Réservation de voyages et organisation de l hébergement  Relations Clients   Accueil des visiteurs   Recevoir et orienter les clients et partenaires    Service à la clientèle   Répondre aux demandes et résoudre les problèmes des clients  Gestion Commerciale   Facturation   Préparation et envoi des factures  Devis et Bon de livraison   Gestion des Fournitures   Gestion des stocks   Suivre et commander les fournitures de bureau    Relations avec les fournisseurs   Communiquer avec les fournisseurs pour les commandes  Soutien à l équipe   Assistance aux équipes   Soutenir les membres de l équipe dans leurs tâches quotidiennes    Recherche d informations   Effectuer des recherches pour des projets ou des rapports    Assister le service export et import dans le suivi des opérations et l élaboration de la liste colisage export    Gestion administrative du personnel  dossiers de mutuelle  classement     Archivage et le suivi de dossiers administratifs     Organisation d évènements internes et externes  formations  réunions  réceptions   Qualités    Excellente présentation  ponctualité  rigueur Si vous êtes intéressé envoyez votre cv Type d emploi   Temps plein  CDI Rémunération   8 000 00DH par mois
Agent Commercial - job post,Barcelo hôtels groupe,En tant qu Agent Commercial en Hôtellerie  vous serez responsable de    Développer et fidéliser un portefeuille clients  entreprises  agences de voyages  organisateurs d événements  etc    Prospecter de nouveaux clients et générer des opportunités commerciales pour l hôtel  notamment pour les réservations de groupes  séminaires  conférences et événements  Assurer la promotion des services et des offres de l hôtel  hébergement  restauration  salles de réunion  événements  etc   auprès des clients existants et prospects  Négocier et finaliser les contrats de réservation et les devis pour maximiser les ventes et les revenus  Suivre les demandes des clients et veiller à leur satisfaction tout au long du processus commercial  Travailler en étroite collaboration avec les équipes internes  réception  marketing  événementiel  etc   pour garantir la qualité du service et des prestations proposées aux clients  Analyser les tendances du marché et surveiller la concurrence pour ajuster les stratégies commerciales  Participer à des événements  salons ou réunions d affaires pour promouvoir l hôtel et élargir le réseau de contacts   Profil recherché    Vous disposez d une expérience réussie dans le domaine commercial  de préférence dans l hôtellerie ou le secteur de l événementiel  Vous avez une excellente connaissance des produits et services liés à l hôtellerie  réservation d hébergements  services de restauration  salles de réunion  etc    Vous êtes dynamique  autonome  et doté e  d un excellent sens du relationnel et de la négociation  Vous êtes à l aise avec les outils informatiques  Word  Excel  logiciels de gestion hôtelière  CRM  etc    Vous avez une grande capacité à travailler en équipe tout en étant orienté e  résultats  Vous êtes force de proposition et savez faire preuve d initiative pour atteindre les objectifs commerciaux  Une maîtrise des langues étrangères  en particulier l anglais  est un atout   Type d emploi   Temps plein  CDI Formation   Licence  Optionnel 
Responsables Bureaux Directs - job post,Atlanta Assurances,AtlantaSanad assurance leader dans son domaine d activité  renforce ses équipes de vente directe et recrute des   Responsables Bureaux Directs   sur différentes régions au Maroc  Vous aimez le métier des assurances  vous êtes intéressé e  par un environnement qui priorise le travail d équipe  vous avez une très bonne fibre commerciale et vous faites preuve d autonomie et d innovation  AtlantaSanad  vous offre une opportunité de carrière avec de réelles possibilités d évolution  Si votre candidature est acceptée  vous serez accompagné e  durant les différentes phases de démarrage et de croissance de votre point de vente et bénéficierez d une formation d un mois sur les métiers de l assurance  Vos principales missions    Développer un portefeuille clients Assurer la gestion administrative de l agence   Proposer  négocier et finaliser les ventes dans le respect de la politique commerciale de la compagnie   Apporter Conseil et expertise aux clients   Réalisation des objectifs commerciaux fixés   Assurer le SAV   Profil Recherché    Connaissances en techniques en assurances   Aisance relationnelle et sens du contact développé   Capacité d adaptation et d écoute   Esprit d équipe et d initiative   Bonne élocution en arabe et en français 
Assistante administration de ventes export - job post,CRIT MAROC,Nous cherchons pour une entreprise à route El Jadida  Lisassfa  une Assistante de Direction et Administratrice des ventes export   Type de contrat    Contrat à durée indéterminée   Profil recherché     Diplôme de formation supérieur en commerce ou une discipline pertinente similaire  Expérience confirmée dans un poste similaire  d au moins 3 ans dans le secteur industriel  Capacité à travailler de manière autonome et en équipe  Excellentes compétences en communication  Maitrise de la langue française  une autre langue notamment l anglais sera un atout   Mission   Elle a pour mission d assister la Direction Général au niveau des travaux et actions commerciales et administratifs  Elle a pour mission aussi de suivre les opérations commerciales exports depuis l élaboration du devis jusqu à la livraison  et mener des actions pour régler les réclamations et les problèmes avec les clients  Tâches a effectuée   En tant qu Administrateur des ventes export    Suivi des dossiers clients Export avec le service gestion commerciale  Suivi des dossiers commerciaux  Rédaction de l Offre Commercial  Suivi de l offre par mail et téléphone  relance  Suivi de la Validation Client  Saisie de la commande sur système et plateforme  Suivi de livraison  Etablissement des tableaux de suivi adéquats  Coordination avec les autres départements  Production  Qualité  BET etc    Recouvrement des Créances des clients export   Tableau de suivi à jour  Suivi des dossiers assurance clients  Traitement du SAV   tableau de suivi  Classement de dossier physique de chaque commande   En tant qu Assistante de Direction    Gestion de l agenda du Directeur général  Gestion des courriers externes de la direction général  Classement et archivage des documents physiques  Gestion administrative des contrats gérés par la direction général   suivi des clauses et archivages   Type d emploi   Temps plein  CDI Rémunération   6 000 00DH à 8 000 00DH par mois
Représentant commercial (H/F/D) pour le marché français - job post,legal.solutions GmbH - Pagestreet,Nous sommes une entreprise de niche avec une excellente réputation et un très haut taux de réussite dans le marché des subventions en Allemagne et en Europe  Nous développons actuellement notre équipe de SDR pour le marché français  Pagestreet se distingue par un service de haute qualité  d excellentes perspectives de développement  et une ambiance de travail agréable au sein d une équipe motivée  autonome et collégiale  Nous recherchons actuellement des talents commerciaux dotés d excellentes compétences rhétoriques  qui souhaitent évoluer avec nous et profiter de nos 10 ans d expérience en vente  La persévérance est elle votre seconde nature et êtes vous passionné par l idée d inspirer de futurs clients avec un service ou un produit d exception   Alors rejoignez notre équipe commerciale haute performance   Vos domaines de responsabilité    Acquisition de nouveaux clients grâce à des entretiens d introduction de haut niveau avec des entreprises moyennes et grandes intéressées Planification et exécution des suivis Réunions d équipe régulières  Votre profil    Maîtrise du français des affaires et de l anglais Vous avez découvert votre talent pour la vente et la prospection Vous êtes motivé à contribuer à l excellence de notre offre de services sous l angle commercial Vous êtes proactif et motivé dans votre travail Vous êtes un joueur d équipe qui n a pas peur de la concurrence  Ce que nous vous offrons    Un bon contrat avec des primes attractives 100  télétravail Une équipe performante et sans complication Des formations régulières en vente Un poste attractif vous permettant de réaliser vos missions avec succès  Ces missions vous attirent elles  et vous voyez vous faire partie de notre équipe   Alors  nous attendons avec impatience de recevoir votre candidature   Job Type  Full time Language   french mothertunge level   Preferred 
EXPERT en mutuelle santé - job post,INFOCEA,INFOCEA Assurances  courtier grossiste en France  cherche à renforcer son équipe à Rabat en recrutant de toute urgence des commerciaux en assurance SANTE  Si vous souhaitez intégrer notre équipe dynamique et soutenir nos clients avec expertise  postulez dès maintenant   Profil recherché     Expérience d au moins 1 an en assurance santé    Compétences exceptionnelles en communication et en négociation    Aisance relationnelle et sens de l empathie    Solide sens commercial  Envoyez votre candidature dès maintenant à   recrutement infocea fr Pour plus d informations merci de nous contacter sur le   06 68 78 96 71 Avantages sociaux et autres    Environnement de travail agréable  Salaire attractif  Primes déplafonnées  Couverture CNSS et AMO   Amplitude horaire   8h30 12h30 14h00 18h00 Salaire de base   primes déplafonnées  Type d emploi   Temps plein  CDI
Administrateur des ventes - job post,Fc media,Cher réseau  Je recherche actuellement un e  Auxiliaire de vente pour intégrer la cellule  Administration des ventes  de FC MEDIA  dont le rôle est la gestion des actions commerciales en back office  Profil   BAC  3 Economie   Gestion   Commerce Qualités   Esprit d équipe  rigueur et sens de réactivité  Aucune expérience professionnelle dans le domaine des médias n est requise  Pour toute interessée  veuillez envoyer votre CV à l adresse ci dessous   contact fcmedia ma Type d emploi   Temps plein  CDI
Assistante administrative - industrie métallurgique - Ain Sebaa - job post,freelance.com,Assistante AdministrativeLocalisation   Ain Sebaa  CasablancaSecteur   Industrie métallurgiqueSalaire   Jusqu à 7 000 MAD Missions Principales En tant qu Assistante Administrative  vous serez l interface entre les différents services de l entreprise et participerez activement à la gestion des tâches administratives et commerciales  1  Gestion Administrative    Traitement et suivi des courriers  emails  et documents administratifs  Organisation des réunions et gestion de l agenda de la direction  Classement  archivage et gestion des dossiers administratifs   2  Support Commercial    Préparation et suivi des devis  bons de commande  et factures clients  Suivi des relances clients et assistance dans la gestion des commandes  Appui dans la gestion des relations clients et fournisseurs   3  Communication Interne et Externe    Assurer une communication fluide avec les autres services  logistique  production   Accueil des visiteurs et prise en charge des appels téléphoniques   Profil Recherché  Expérience   Minimum 5ans en assistanat administratif  idéalement dans un secteur industriel  Compétences linguistiques   Maîtrise du français et de l arabe  à l écrit comme à l oral  Compétences techniques   Bonne maîtrise des outils bureautiques  Word  Excel   Qualités personnelles   Bon relationnel  rigueur  organisation  et sens de la discrétion   Type d emploi   CDI Rémunération   7 000 00DH par mois Question s  de présélection   5 ans d experience minimum
Faites la Différence en tant que Commercial en Prospection BtoB - job post,Groupe OMF,Faites la Différence en taSalaire   15 000 DHS   Primes Non Plafonnées Nous sommes un acteur dynamique dans l accompagnement des chefs d entreprise dans le secteur BtoB  Dans le cadre de notre développement  nous recherchons des commerciaux passionnés et talentueux  prêts à saisir de nouvelles opportunités  Ce que nous offrons   Rémunération Attractive   Salaire de 15 000 DHS et plus  avec des primes non plafonnées  Formation Continue   Accès à des formations sur les techniques de vente modernes  nos solutions et des outils de prospection automatisée  Défis Quotidiens   Un environnement stimulant où chaque situation est unique  Évolution Professionnelle   Possibilité d évoluer vers un poste de Business Developer à 360  en 12 mois  selon vos performances  Proximité avec la Direction   Contact direct avec les fondateurs  Autonomie et Responsabilité   Prenez des initiatives dès le début  Cadre de Travail Agréable   Poste basé à Casablanca dans des locaux modernes et conviviaux  Ce que nous recherchons   Sales Expert   Expérience solide en vente BtoB avec un bon bilan de résultats  Esprit Entrepreneurial   Capacité à prendre des initiatives et à travailler de manière autonome  Talent de Convaincre   Habilité à transformer des prospects en clients  Écoute et Confiance   Aptitude à instaurer une relation de confiance avec les clients  Communication Efficace   Excellentes compétences en communication  tant à l oral qu à l écrit  Connaissance du Digital   Bonne compréhension des enjeux du digital pour mieux accompagner les clients  Vos Défis Quotidiens   Identification et Prospection   Ciblez des décideurs clés grâce à la prospection téléphonique et terrain  Analyse et Qualification   Comprenez les besoins des prospects et analysez les opportunités  Apport de Valeur   Devenez un élément clé dans la création de valeur pour nos clients potentiels  Type d emploi   Temps plein  Temps partiel
