Job Title,Company,Link,Description
Facilities Manager - job post,CADMUS® International School – Zenata,Job Purpose Ensuring that the school campus and facilities are well maintained in a manner that allows students to benefit from the state of the art campus and the full range of a SABIS  education  Key Responsibilities   Overseeing the operations and maintenance of all plant  equipment    campus buildings Monitoring the maintenance of all functional building systems relating to campus utilities  ensuring minimization of disruptions to the running of the campus facilities arising from maintenance incidents Managing operations of the Security  Cleaning and Gardening Team Producing periodic utility reports on a timely basis Conducting daily inspections of the property to ensure security of the assets  maintaining a log of any preventive maintenance  health  safety and security incidents Ensuring grounds and exterior areas are well maintained Reporting any faults or damages to school management Ensuring that all building management equipment is operating within defined performance level expectations and overseeing service level agreements with third parties Planning  organizing  and overseeing the implementation of planned preventative maintenance  routine maintenance and any special projects within budget and agreed upon KPI s Fostering good working relationships with statutory regulators to ensure timely compliance with regulation at all times Ensuring that all visitors  staff  and outsourced personnel are adequately instructed in environmental health  safety  and welfare whilst within the campus  responding adequately to emergencies or urgent issues arising Overseeing the implementation of Solid Waste Management Performing other tasks as assigned by the School Management  Ideal Requirements   Bachelor degree in a related field  Facilities Management   Engineering  English Proficient A minimum of 5 years of experience in construction and or property management  with a minimum of two years in a supervisory capacity  Accountability and Taking Ownership Professional Behavior and Ethical Conduct Delivering Results Continuous Learning and Improvement  Type d emploi   Temps plein  CDI Rémunération   7 000 00DH à 9 000 00DH par mois Formation   Bac   2  BTS  DUT   Optionnel 
Kundenservice-Mitarbeiter (Deutschsprachig) - job post,Pathbloom,Standort  Home OfficeAbteilung  KundenserviceBerichtet an  Kundenservice ManagerStellenart  Teilzeit Unternehmensbeschreibung PathBloom ist eine führende Personalvermittlung  die mit namhaften Unternehmen zusammenarbeitet  um talentierte Fachkräfte mit spannenden Karrieremöglichkeiten zu verbinden  Derzeit suchen wir für einen unserer Kunden einen deutschsprachigen Kundenservice Mitarbeiter  Wenn Sie leidenschaftlich gerne mit Kunden arbeiten und fließend Deutsch sprechen  ist diese Stelle genau das Richtige für Sie  Stellenbeschreibung Als Kundenservice Mitarbeiter bei PathBloom werden Sie für einen unserer Kunden tätig sein  indem Sie potenzielle Kunden telefonisch kontaktieren  um deren Produkte zu präsentieren und zu fördern  Sie sind verantwortlich für die Bereitstellung hochwertiger Dienstleistungen  die Beantwortung von Anfragen und die Sicherstellung  dass die Kunden mit den angebotenen Produkten zufrieden sind  Hauptaufgaben   Führen von ausgehenden Anrufen bei potenziellen Kunden  um die Produkte unseres Kunden zu präsentieren und zu erklären  Bereitstellung detaillierter und genauer Produktinformationen auf Deutsch  Beantwortung von Kundenanfragen und Lösung von Problemen  Aufrechterhaltung einer positiven und professionellen Einstellung gegenüber Kunden zu jeder Zeit  Dokumentation der Kundeninteraktionen und Pflege des CRM Systems  Nachverfolgung von Leads und Kunden  um die Zufriedenheit zu gewährleisten und den Umsatz zu steigern  Erreichen oder Übertreffen von täglichen und monatlichen Anruf  und Zufriedenheitszielen  Zusammenarbeit mit den Teams für Vertrieb und Marketing  um das Kundenengagement zu verbessern   Qualifikationen   Fließende Deutschkenntnisse  sowohl mündlich als auch schriftlich  sind erforderlich  Ausgezeichnete Kommunikations  und zwischenmenschliche Fähigkeiten  Erfahrung im Kundenservice oder im Vertrieb ist von Vorteil  Fähigkeit  selbstständig zu arbeiten und mehrere Aufgaben gleichzeitig zu bewältigen  Starke Problemlösungsfähigkeiten und Liebe zum Detail  Erfahrung im Umgang mit CRM Software und anderen Kundendiensttools  Bereitschaft  bei Bedarf flexible Arbeitszeiten zu akzeptieren   Vorteile   Wettbewerbsfähiges Gehalt und leistungsabhängige Anreize  Umfassende Schulung und fortlaufende Unterstützung  Möglichkeiten für berufliches Wachstum und Aufstieg innerhalb des Unternehmens   Wenn Sie ein engagierter Mensch sind  der gerne mit Kunden interagiert und einen exzellenten Service bieten möchte  freuen wir uns auf Ihre Bewerbung  Bewerben Sie sich jetzt und werden Sie Teil des PathBloom Teams  um die Produkte unseres Kunden einer breiten Zielgruppe vorzustellen  PathBloom ist ein Arbeitgeber  der die Chancengleichheit fördert  Wir ermutigen Bewerber aus allen Hintergründen  sich zu bewerben  Art der Stelle  Teilzeit Gehalt  5 000 00DH   10 000 00DH pro Monat Erwartete Arbeitsstunden  5 10 pro Woche Sprache   Deutsch  Erforderlich 
Community manager et Commercial Junior - Commissions Motivantes - job post,ACTING INSTITUTE,Description   Nous recherchons un profil junior motivé  dynamique  et ambitieux pour rejoindre l équipe d Acting Institute et Ellipsis Production  Nous sommes spécialisés dans les arts de la scène et du cinéma  Le poste est basé à Casablanca avec un salaire basique  Cependant  tu toucheras des commissions importantes basées sur tes performances commerciales  Si tu es autonome  audacieux  et prêt à travailler dur pour obtenir d excellents résultats  ce poste est fait pour toi   Présentation   Acting Institute et Ellipsis Production sont des institutions réputées dans les arts de la scène et du cinéma  Nous cherchons des talents motivés qui souhaitent évoluer dans une équipe créative et ambitieuse  Mission   Développer des stratégies de communication efficaces pour promouvoir nos services  Identifier et prospecter de nouveaux clients et partenaires  Assurer la gestion et le suivi des relations clients  Contribuer à la réalisation des objectifs de chiffre d affaires par la vente de nos offres  formations  productions  événements   Gérer les réseaux sociaux  les événements et la communication digitale  Participer activement aux projets de l institut et de la production  Profil   Junior  avec une première expérience dans la communication et ou la vente  Avoir la  niaque    un vrai goût pour le challenge  l autonomie et le dépassement de soi  Capacité à s adapter et à apprendre rapidement  Forte orientation résultats  avec une appétence pour les commissions sur objectifs  Très bon relationnel  organisé e   et autonome  Excellentes compétences en communication  orale et écrite   Type d emploi   Temps plein  CDI Rémunération   3 500 00DH à 4 000 00DH par mois Langue   Français  Requis 
Graphic Design - job post,Medify,En tant que stagiaire en graphisme et montage vidéo au sein de notre agence  vous aurez l opportunité de travailler avec une équipe passionnée et de mettre en pratique vos compétences en graphisme et en montage vidéo  Ce stage d une durée de 3 mois vous permettra d acquérir une expérience précieuse  de développer vos compétences et de contribuer à des projets stimulants Exigences    Étudiant e  en graphisme  montage vidéo  arts visuels ou domaine similaire  Maîtrise des logiciels de conception graphique  Adobe Photoshop  Illustrator  et de montage vidéo  Adobe Premiere Pro  CapCut  etc    Créativité  souci du détail et passion pour le design et la vidéo  Capacité à travailler en équipe et à respecter les délais  Ce que nous offrons    Une expérience pratique dans les domaines du graphisme et du montage vidéo au sein d une agence en pleine croissance  La possibilité de développer votre portfolio en travaillant sur des projets concrets  Un environnement de travail créatif et stimulant  La chance d apprendre aux côtés de professionnels chevronnés du secteur   Rejoignez notre équipe pour un stage enrichissant qui vous permettra de développer vos compétences en graphisme et en montage vidéo tout en contribuant à des projets inspirants  Envoyez votre CV et votre portfolio à   contact medify ma   pour postuler  Type d emploi   StageDurée du contrat   3 mois Rémunération   à partir de 1 000 00DH par mois Type d emploi   Temps plein  Stage
Aide maîtresse maternelle - job post,CADMUS® International School – Zenata,CADMUS  International School   Zenata  part of SABIS   a global education network  is recruiting a KG Teaching Assistant  Job Purpose Providing support and assistance to teachers inside and outside the classroom  Helping students understand and complete their assignments  while ensuring a safe  productive  and clean environment  Key Responsibilities   Assisting the teacher to monitor the class schedule  Keeping a record of children s attendance and taking and delivering the attendance form from to the office  Handling class displays  games  and visual material  including written or drawn bulletin boards aligned with class work and topics  in accordance with the teacher s directions  Reinforcing class and school rules and students  behaviors  Documenting students  progress and communicating with the respective Academic Quality Controller  AQC  when needed  Filing notes into children s reading folders and checking them every morning for new notes  Ensuring that the classroom is safe and clean  Supporting the class teacher during the lesson by keeping children focused and attentive  Assisting the teacher in the process of correcting children s work  Preparing  supervising  and cleaning up after students  snack or lunch time  wiping tables  washing cups and plates  helping kids get food from the counter  etc    Teaching students  proper hygiene manners and helping them change their clothes in case of an accident  Supervising outdoor play  Supervising nap or quiet time  Accompanying students to the class in the morning and assisting with Morning Care supervision  Listening actively to students and reading their word cards  Preparing material and utensils for art classes and cleaning up after every lesson  Helping with school events  trips  and activities  Performing other related tasks as they arise and as delegated by the School Management  Ideal Requirements   Bachelor degree in Education English and French Proficient Professional behavior and ethical conduct Delivering results Continuous improvement Accountability and taking ownership Excellent communication skills  Type d emploi   Temps plein  CDI Rémunération   3 000 00DH à 6 000 00DH par mois
Réceptionniste Spa - job post,Four Seasons,About Four Seasons   Four Seasons is powered by our people  We are a collective of individuals who crave to become better  to push ourselves to new heights and to treat each other as we wish to be treated in return  Our team members around the world create amazing experiences for our guests  residents  and partners through a commitment to luxury with genuine heart  We know that the best way to enable our people to deliver these exceptional guest experiences is through a world class employee experience and company culture    At Four Seasons  we believe in recognizing a familiar face  welcoming a new one and treating everyone we meet the way we would want to be treated ourselves  Whether you work with us  stay with us  live with us or discover with us  we believe our purpose is to create impressions that will stay with you for a lifetime  It comes from our belief that life is richer when we truly connect to the people and the world around us   About the location  Bathed in natural light  our seaside Hotel cascades down a hillside toward the Atlantic  Perched on a beach just 10 minutes from the heart of Morocco s largest and liveliest city  the sweeping views you ll find from your private balcony easily fulfill the romantic reputation that precedes Casablanca  With architectural marvels both historic and modern  a cutting edge art scene and world class restaurants  allow us to show off the best of our alluring port city  starting with a plate of fresh local seafood prepared à la minute at Bleu  Our Oceanfront sanctuary offering a resort like atmosphere minutes from the city s key business districts and cultural landmarks opened in November 2015  and has 186 rooms  3 food and beverage outlets including a grill   seafood restaurant  a modern Moroccan lobby lounge serving exquisite tea times and a poolside restaurant famous for its Sundays barbecues  an outdoor pool with private poolside cabanas  fitness center  and a stunning spa offering bespoke treatments that pay tribute to ancestral beauty techniques and ancient Moroccan traditions at Le Spa     About the role  The Spa Receptionist proactively welcomes guests  is knowledgeable about treatments  products and services offered as well as pricing  and scheduling   What you will do   The Spa Receptionist is a central part of the Spa Team whose main objective is to ensure our guests have a smooth arrival  information gathering and departure experience in the Spa  As the first and last impression of the Spa  this high profile department carries a special responsibility  The role involves the active promotion of spa therapies and treatments both on the phone and in person ensuring that accurate reservations are made  Weekend shifts required  Perform all morning and evening shift tasks  Distribute appointments fairly  Advise customers of products for sale according to their needs  Ability to meet exceed sales targets  Know and apply cash register closing procedures  Ensure the well being of each customer  Refer to customers by name whenever possible  Coordinate the work of team members on a daily basis  Maintain the reception and relaxation areas throughout the day  Work with the Security department to manage forgotten items in accordance with Four Seasons internal procedures  Keep the Manager or Assistant Manager informed of all customer complaints  Adhere to Four Seasons standards   What you bring   Outgoing personality and a can do approach to any task   personifying luxury guest service Previous experience within luxury hospitality preferable  Understanding of Spa environments and treatments beneficial  Excellent communication skills and the ability to take a proactive approach to understand guests  needs and desires  Exceptional customer service skills and Problem solving ability Good level of reading  writing  and spoken English and French is highly required  Computer skills  word  excel   PowerPoint presentation  Able to operate the opera systemFamiliarity with Spa Booking Software     What we offer    Competitive Salary  wages  and a comprehensive benefits package Excellent Training and Development opportunities Complimentary Accommodation at other Four Seasons Hotels and Resort Complimentary Dry Cleaning for Employee Uniforms Complimentary Employee Meals
magasinier - job post,extra art travaux,MAGASINIER Nous cherchons un Magasinier pour notre magasin de matériel de climatisation et ventilation avoir les connaissances et les informations techniques nécessaires des différentes articles électriques de climatiseur et la maitrise totale du Système de stock  Le candidat retenu aura pour mission principale la gestion  l inventaire régulier et la vérification du stock de nos chantiers  Profil Recherché  Capacité à travailler de manière autonome et organisée  Bonne communication et esprit d équipe  Polyvalence et adaptabilité aux environnements variés  Responsabilités Principales    Réception  rangement et gestion du stock de matériels de climatisation et Accessoires   Inventaires réguliers et mise à jour des registres de stock    Préparation des commandes    Collaboration avec les équipes pour répondre à leurs besoins  Si vous êtes passionné par l univers de climatiseur avec une expérience pertinente au minimum 2 ou bien 3 ans de l expérience dans la gestion de stock  rejoignez notre équipe dynamique et créative en postulant à cette offre dès maintenant avec votre CV Type d emploi   Temps plein Rémunération   3 000 00DH à 5 000 00DH par mois
Institut d'apprentissage de langue allemande - job post,Allamo institut,Allamo institut un centre d apprentissage spécialisé en langue allemande  il est dans la recherche de deux professeurs de langue allemande  _ Profil recherché  _  Formation et expériences      Formation de BAC 3 BAC 5 en langue allemande    Expérience Min 1 an dans un poste similaire   Attitudes et comportement professionnels      Aisance relationnelle et discrétion    Capacité de gérer un effectif important    Flexible et à pouvoir se déplacer   Intéressé par la culture allemande Salaire    à discuter Art der Stelle  Teilzeit Erwartete Arbeitsstunden  8 pro Woche
METRACO recrute en urgence son/sa Chargé(e) Marketing et Communication à Casablanca ! - job post,METRACO,Principales responsabilités  Stratégie et Planification   Analyser le marché de l électroménager  la concurrence  les attentes des consommateurs et les tendances  sociétales  technologiques      et dresser un diagnostic  Cerner les cibles commerciales  Élaborer un plan marketing et de communication multicanal  Conception de Supports de Communication   Créer des supports visuels  dépliants  brochures  catalogues  fiches produits  publicités       qui assure une présentation visuelle attrayante et fidèle à l image de marque  en utilisant des techniques de publication assistée par ordinateur  Assurer les relations et collaborer avec les agences de communication et autres prestataires externes pour les supports de communication le nécessitant  PLV  roll ups       Rédiger du contenu informatif et accrocheur mettant en avant les avantages et caractéristiques de nos produits  Gérer le budget des opérations de communication sous l autorité de la hiérarchie  Communication Digitale   Assurer le volet  Community Management  en animant quotidiennement les réseaux sociaux via la publication de contenu pertinent  des conseils d utilisation et tutoriels  des nouveautés produits  des promotions  des quiz  des jeux concours  tirages au sort  challenges hashtag  concours de compétences      le tout en optant pour les tendances actuelles de publication  Stories  vidéos courtes TikTok   reels  Instagram    et en interagissant avec la communauté de followers  Optimiser le site web avec du contenu adapté  des vidéos de démonstration et des avis clients  Mettre en place des campagnes de marketing par e mail pour maintenir une relation étroite avec la clientèle et la fidéliser  Campagnes Publicitaires et Partenariats   Concevoir avec les agences de communication des campagnes publicitaires sur différents canaux  Radio  web  etc    Établir des partenariats avec des influenceurs et des blogueurs spécialisés dans le domaine de l électroménager et du lifestyle  Evénements et Relations Publiques   Organiser et superviser la participation de l entreprise à des salons et expositions spécialisés  Planifier des événements de lancement pour les nouveaux produits et coordonner les relations presse  Entretenir un réseau dans le monde des médias  Analyse et Reporting   Utiliser des outils analytiques pour évaluer l efficacité des campagnes et ajuster les stratégies en conséquence  Préparer des rapports détaillés sur les indicateurs de performance  KPI  et les présenter à la hiérarchie  Compétences techniques requises  Expertise en communication digitale et traditionnelle  Capacité à analyser des données de marché et à en tirer des stratégies pertinentes  Maîtrise obligatoire des outils de publication assistée par ordinateur  particulièrement les logiciels d infographie  Illustrator  Photoshop      et de montage vidéos   Configuration des campagnes Meta Business Manager  des Google Ads et de Google Analytics  Maîtrise des outils bureautiques  Compétences comportementales  Créativité et curiosité intellectuelle  Esprit d analyse et de synthèse  Qualités relationnelles  capacité à entretenir un réseau  Capacité à s organiser  à travailler sous pression et à gérer plusieurs projets simultanément  Sens des responsabilités  autonomie  capacités d adaptation  Force de proposition  Autres prérequis  Très bonne communication en français à l écrit comme à l oral  Maîtrise de l anglais professionnel  Passion pour l univers de l électroménager et compréhension des attentes des consommateurs dans ce domaine  Qualifications  Diplôme de Bac 3 à Bac 5  particulièrement en design graphique ou en arts visuels  4 années d expérience dans le poste  avec une expérience confirmée en graphisme  incluant une expérience obligatoire en agence de communication  Disponibilité requise  Dans les plus brefs délais Un portfolio de vos créations  si vous en disposez  est un plus à joindre à votre candidature Veuillez postuler via cette offre ou par email sur  rh metraco ma  uniquement si votre profil correspond à l annonce et à ses qualifications Type d emploi   Temps plein
PE TEACHER - job post,Inspired,PE TEACHER         Location  Rabat  MA             Date  22 Nov 2024             Application closing date                   Inspired Education is the leading global group of premium schools  with a portfolio of 118 premium private schools spanning 6 continents which utilise proven educational practices from every corner of the globe  ensuring over 90 000 students receive a world class learning experience from Kindergarten to Year 13                In 27 countries  Inspired schools are individually developed and anchored in the vibrant cultures of their respective locations  They collectively form an international family of schools that nurtures each student s academic and personal development in a progressive  dynamic  and innovative learning environment                By joining our award winning team of over 13 000 employees  you can work in state of the art facilities alongside industry renowned educators and leaders in some of the world s most desirable locations  We invest heavily in our team members who enjoy industry leading professional development  exceptional career opportunities  and mobility across our group             ROLE SUMMARY        Lesson Planning   Instruction    Develop and implement age appropriate physical education curricula that support students  physical  social  and emotional development  Teach physical activities such as gymnastics  sports  fitness routines  and recreational games  Foster a positive learning environment that encourages student participation and achievement in physical fitness     Physical Fitness   Health Education    Teach students the importance of exercise  healthy habits  nutrition  and overall well being  Conduct fitness assessments  track progress  and provide feedback on improvement     Classroom Management    Manage student behavior in a safe and respectful manner  Create and maintain a classroom environment conducive to learning and physical activity  Ensure proper use of sports equipment and facilities     Sports   Extracurricular Activities    Coach and lead students in extracurricular sports teams and competitions  Organize school wide fitness events  tournaments  and wellness programs  Promote team building and sportsmanship through group activities and games     Assessment   Reporting    Assess student performance in physical activities and fitness  Provide feedback on individual and group progress  and maintain records of student performance  Communicate regularly with parents  guardians  and school administration regarding students  progress         THE IDEAL CANDIDATE WILL HAVE        Education    Bachelor s degree in Physical Education  Sports Science  or a related field  Certification in teaching physical education  may vary by state country       Experience    Previous teaching experience  especially in physical education  is preferred  Experience in coaching sports teams or organizing fitness programs is a plus     Skills    Strong knowledge of physical fitness  sports  and health education  Excellent communication  interpersonal  and organizational skills  Ability to motivate and inspire students to participate and excel in physical activities  Ability to create a safe  positive  and inclusive learning environment         SAFEGUARDING STATEMENT              Inspired Education Group is committed to safeguarding and promoting the welfare of children and young people and expects all staff  volunteers and other third parties to share this commitment  Safer recruitment practices and pre employment background checks will be undertaken before any appointment is confirmed                 School Application Form              Please download and fill up this form  attach this during application process                        Visit our careers site for more information  https   jobs inspirededu com
