Job Title,Company,Link,Description
Data Scientist - job post,AVL Maroc SARL AU,Data Scientist  ABOUT AVL   AVL is the world s leading mobility technology companies for development  simulation and testing in the automotive industry  and in other sectors  As a global technology provider  AVL s offerings range from simulation  virtualization and test automation for product development to ADAS AD and vehicle software   We are currently seeking a talented individual to join our team as a Data Scientist   YOUR RESPONSIBILITIES     Development of analytical models and algorithms Close collaboration with stakeholders across the organization to identify opportunities to develop solutions from data Extract and analyze data from different databases    YOUR PROFILE     Experience in handling and creating cloud based data products  AWS  Experience in using statistical programming languages  Python  SQL etc   to manipulate data and derive insights from a large amount of data Knowledge of various machine learning methods  e g  clustering  decision tree learning artificial neural networks  etc   Knowledge of statistical methods and concepts  e g  regression  statistical distribution  Good communication skills Tasks and Responsibilities At least 7 years of professional experience in the field of data science   at least 1 year of professional experience in project management   WE OFFER    Be part of our pioneering work  together with our customers we shape the future of mobility  Our technical and personal onboarding concept will help you to hop on easily  We support lifelong learning  educate yourself  apply your knowledge and get creative  Mobile working  flexible worktime and modern workplaces are part of our DNA  We are deeply rooted in our values  respectful communication  care  openness  passion  and trust Cafe and restaurant in the office building Employee events   If you are a dynamic individual with the required skills and experience  we invite you to apply for this exciting opportunity   Interested  If so  please use our online application tool to send your application to AVL        About AVL AVL is one of the world s leading mobility technology companies for development  simulation and testing in the automotive industry  and beyond  We provide concepts  solutions and methodologies in fields like vehicle development and integration  e mobility  automated and connected mobility  ADAS AD   and software for a greener  safer  better world of mobility  Find out more  www avl com     You are interested in a job at AVL but you are not sure how to apply or want to know what happens after you send your application   Check out our step by step guide     AVL is not just about cars  It s about changing the future  Together                Location  Sala Al Jadida  MA                    Company  AVL Maroc SARL AU                    Job Function  Electrification Electrical Electronic                    Contract Type  Permanent                    Posting Date  Nov 24  2024                    Job ID  36772            About AVL AVL is one of the world s leading mobility technology companies for development  simulation and testing in the automotive industry  and beyond  We provide concepts  solutions and methodologies in fields like vehicle development and integration  e mobility  automated and connected mobility  ADAS AD   and software for a greener  safer  better world of mobility  Find out more  www avl com     Job Segment  Testing  Scientist  Project Manager  Product Development  Scientific  Technology  Science  Research  Engineering
Big Data Engineer - job post,Leyton Maroc,Leyton Morocco is a leading force  offering essential assistance in business and engineering services worldwide  Our team s proficiency in handling complex operations  along with a diverse language skill set  positions us to cater to a global clientele  Our areas of specialization encompass innovation funding  consulting  energy  and outsourced services   Main Responsibilities  Design and implement infrastructure for managing the company s data in alignment with various business challenges  Develop and manage data flows  including ingestion  modeling  warehousing  and cleaning  using Big Data technologies  Analyze source systems to define optimal data management strategies from collection to analysis  Collaborate with cross functional teams to integrate Big Data solutions with existing systems  Optimize and maintain Big Data platforms for performance  reliability  and scalability  Develop and enforce data governance policies to ensure data quality and security  Create and maintain documentation related to data architecture  processes  and workflows  Conduct performance tuning and troubleshooting to resolve data related issues  Develop data visualizations and reports to support business decision making  Lead and participate in code reviews to ensure code quality and best practices   Qualifications  Bachelor s Degree in Software Development  Computer Engineering  or a related field  Expertise in one or more Big Data technologies  Certifications in Big Data technologies are a plus  1 to 3 years of experience in a similar role  Proficiency in understanding complex data processing algorithms and mechanisms  Skills   experience in Python and SQL  Spark  Airflow  Kafka  RabbitMQ  ElasticSearch  and the ELK Suite   MongoDB  Neo4J  Docker  and front end frameworks like Angular  React  or Vue js  Excellent listening  synthesis  and analytical skills  Intellectual curiosity  initiative  and proactivity  Strong organizational skills and the ability to work autonomously  Excellent interpersonal skills and the ability to facilitate team collaboration   What We Offer  Competitive salary with flexible working hours  Work life balance and numerous social benefits  A start up spirit within a fast growing multinational group  Opportunities for career growth and project diversification  A continuous learning environment with team building activities  Health and wellness partnerships  Join us to leverage your Big Data expertise and contribute to innovative projects in a dynamic and supportive environment 
Data Scientist (REF04) - job post,Trusted Advisors,Nous sommes à la recherche pour le compte d une banque internationale  basée à Casablanca  un Data Scientist   Missions   Activités   a  Cas de nouveaux besoins    Cadrage et définition du besoin avec les métiers Ateliers avec les équipes digital  architecture  infrastructure pour fournir les prérequis à l industrialisation des modèles Développement des modèles sur le datalab Partage itératif des résultats obtenus Planification de phase de tests avec les métiers Ajustements suite aux retours des métiers Mise en production et ordonnancement du modèle sur la plateforme dédiée Documentation des modèles développés Formation sur les modèles développés   b  Modèles existants    Interactions avec les équipes architecture  DIFA  IT pour l industrialisation des modèles Tests des modèles sur les plateformes datalab et de production Echange avec les métiers pour cibler les améliorations à apporter aux modèles Monitoring des résultats vs prévisions Documentations associées   Profil Recherché    Ingénieur  BAC  5 ou plus   ayant minimum 2 ans d expérience dans le domaine bancaire  Data scientist confirmé  avec un minimum de 5 ans d expérience dans le développement de modèles analytiques et Machine Learning    Compétences opérationnelles   Expérience dans le domaine bancaire sur des sujets analytiques  Bonne connaissance des outils Python  GytHub  Capacité à développer sous Sql Connaissances des méthodes de gestion de projet en AGILE Bonnes capacités d analyse et rédactionnelles Une capacité de coordination avec les différents acteurs d un projet Maitrise des méthodologies projets  Cadrage  conception  Homologation Bancaire  Conduite de Changement       Sens de la communication et aisance relationnelle   Compétences techniques   L asset technologique est basé sur les technologies suivantes    Language Environnement de développement   Python Anaconda  JupyterLab  Gitlab Machine Learning   Scikit learn Ordonnanceur   Air flow ETL   Talend  SQL Server Reporting   Business Objects  Cognos  SAS UNIX Windows   Scripting Shell Power Shell  Durée la mission   3 mois renouvelables  Projet sur minimum 1 année   Lieu   Casablanca
Data Scientist - job post,Attijariwafa Bank,Data Scientist  Attijariwafa bank est le premier groupe bancaire et financier du Maghreb et un acteur financier de référence en Afrique  En plus de l activité bancaire  le Groupe opère  à travers des filiales spécialisées  dans tous les métiers financiers   assurance  crédit immobilier  crédit à la consommation  leasing  gestion d actifs  intermédiation boursière  conseil  location longue durée  factoring  Attijariwafa bank est basée au Maroc et opère dans 25 pays  Avec 20 602 collaborateurs  le groupe Attijariwafa bank compte 10 2 millions de clients  Il dispose du réseau de distribution le plus large au Maroc et le plus dense en Afrique avec 5 265 agences  Dans le cadre de notre développement  nous sommes à la recherche d un Senior Data Scientist confirmé pour rejoindre l équipe Data  une équipe dynamique et en pleine croissance au sein de notre IA Center  Le rôle du Data Scientist s articulera autour du développement des algorithmes d intelligence artificielle  basés sur des techniques analytiques avancées et des modèles d apprentissage automatique     Vos missions    Comprendre les besoins analytiques des collaborateurs de la banque et savoir les traduire en solutions basées sur l algorithmique avancée et l intelligence artificielle et tenant compte du potentiel retour sur investissement Concevoir  implémenter et superviser les solutions d IA de la banque tout en suivant une méthodologie scientifique rigoureuse et en assurant une qualité technique élevée Travailler au sein d équipes agiles afin d apporter une valeur business mesurable par votre travail  Documenter votre démarche tout au long de la réalisation de sorte à permettre à l équipe projet d assurer un suivi efficace Maintenir un catalogue des assets data disponibles et assurer une bonne compréhension technique et fonctionnelle de données diverses et volumineuses Participer activement aux efforts d assainissement des données de la banque en relevant les anomalies présentes au sein des assets data et les communiquer aux équipes concernées Présenter ses résultats sous une forme synthétisée et claire de sorte à communiquer la valeur business générée à une audience diversifiée  Profil recherché    Vous êtes diplômé e  en Master ou école d ingénieur spécialisée en statistiques  technologies data ou mathématiques Vous avez au moins 3 ans d expérience dans la mise en production de solutions logicielles basées sur les algorithmes d intelligence artificielle Vous êtes capable de traduire un besoin métier en hypothèses statistiques et les tester à partir d ensemble de données brutes Vous maîtrisez les techniques de visualisation et d analyse exploratoire de données pour la génération d insights à forte valeur ajoutée à partir de données traitées Vous avez une très bonne connaissance de l écosystème Big Data et une capacité à naviguer dans des environnements complexes de manière organisée et documentée Vous avez une très bonne connaissance des modèles de données et une capacité à maintenir une compréhension technique et fonctionnelle de données diverses Excellentes capacités de communication professionnelle  souci d inscrire son travail personnel dans un collectif efficace et productif
Test Plot Manager - job post,Driscoll's,Join Driscoll s Global Research and Development team  dedicated to introducing innovative berry varieties to consumers worldwide  Our proprietary variety selection process involves cultivating new berry varieties in facilities that represent our diverse production regions  As the Test Plot Manager in Moulay Bousselham  Morocco  you will lead on farm plant care and provide technical support for our Breeding   Applied Research programs  focusing on strawberries  raspberries  blueberries  and blackberries  Your role will include managing crew activities and overseeing the establishment  cultivation  maintenance  and inventory of proprietary berry plants in both tunnels and open air fields     Responsibilities  Directly manage the test plot Technical Grower and Lead Field Supervisor Responsible for making recommendations regarding the hiring  evaluation  and discipline of research ranch staff Manage Applied Research and Breeding trials for blueberry  blackberry  strawberry  and raspberry crops in Moulay test plot Responsible for maintenance of all plants including  but not limited to  proper watering  weeding  fertilizing  transplanting  pruning  disease  and insect control in the test plot Maintains records of all treatments applied  Ensures once plant material has served its purpose it is disposed of or transported to an appropriate location in a timely manner Coordinates with stakeholders and members of Farming Operations regarding planning layout  preparation of ground  and planting of the Blueberry  Blackberry  Strawberry  and Raspberry on an annual basis Responsible for all cultural practices at test plots  including land preparation  bed preparation  and planting Ensures all plant material is labeled  inventoried and all appropriate treatments are applied to this material Ensures the harvest is done correctly and make sure that the data is collected properly Responsible for Fruits shipping for Flavor and shipping evaluation in collaboration with stakeholders and colleagues Assure a safe working environment and advocate safety compliance Responsible for equipment repairs and maintenance Responsible for labor forecasts needs and activities Performs monthly credit card expense reporting in a timely manner Maintains the overall appearance  housekeeping  and safety of test plot Follows Company policies and practices while representing Driscoll s in an ethical and business like manner in all interactions with employees  government agencies  growers  etc  Ensures the safe keeping of propriety varieties and confidential information    Candidate Profile  Bachelor s Degree Agriculture Engineering  Master s Degree in Agriculture preferred Minimum of 5 years  experience working in a commercial berry production operation or comparable horticultural operation Ability to work as part of a team and collaborate with other members of breeding  Applied Research and farming operations  always striving to achieve team goals Three plus years of experience as a team leader  supervising the work of others Solid understanding of field preparation  plant growing and plant maintenance procedures and techniques Experience with growing practices  irrigation systems and farm equipment Knowledge of pesticide laws and regulations  and pesticide applications Willingness to learn new skills to support personal and professional growth Must possess good verbal and written communication skills Speaks fluently in English Possess a valid driver s license A valid passport and the ability to travel internationally without restrictions     IMPORTANT NOTE  When applying  please include resume CV in English      About Driscolls Driscoll s is the global market leader for fresh strawberries  blueberries  raspberries and blackberries  With more than 100 years of farming heritage and hundreds of independent growers around the world  Driscoll s is passionate about growing fresh  beautiful and delicious berries  Our values of humility  passion and trustworthiness have guided our mission to delight consumers around the world  Driscoll s exclusive patented berry varieties are developed through years of research using only natural breeding methods   meaning  no GMOs  From farm to table  we focus on delivering a high quality  premium berry experience with our many supply chain partners  Driscoll s is the trusted brand for Only the Finest Berries    Driscoll s es el proveedor líder en la comercialización de Fresas  Frambuesas  Zarzamoras y Arándanos Azules en el mundo  Con más de 100 años de herencia en agricultura y cientos de productores independiente alrededor del mundo  Driscoll s es una compañía apasionada por cultivar Berries frescas  hermosas y deliciosas  Nuestros valores de humildad  pasión y confianza han guiado nuestra misión de deleitar a los consumidores en el mundo  Las variedades exclusivas de Driscoll s han sido desarrolladas a través de años de investigación usando sólo métodos de mejoramiento natural  De la granja a la mesa  nos enfocamos en ofrecer una experiencia de alta calidad con apoyo de nuestros socios de la cadena de suministro  Driscoll s es la marca de confianza de sólo las mejores Berries 
HR Generalist - job post,Ecolab,About the job   At Ecolab  we believe that clean water  safe food  abundant energy  and healthy environments are fundamental to the success of businesses and the well being of people everywhere  With operations in over 170 countries  we deliver comprehensive solutions to customers in a wide range of industries  including food and beverage  healthcare  hospitality  manufacturing  and more  Our innovative technologies and sustainable practices are making a real difference in conserving resources  protecting lives  and improving the quality of life for millions around the globe  Ecolab is seeking an HR Generalist as contingent to provide strategic human resource generalist consultation to associates and managers  You will play a crucial role in the day to day administration of HR policies and programs  This encompasses various functions such as recruiting compensation and benefits  training  employee and labor relations  safety  and personnel research   What s in it For You   The opportunity to take on some of the world s most meaningful challenges  helping customers achieve clean water  safe food  abundant energy and healthy environments The ability to make an impact and shape your career with a company that is passionate about growth The support of an organization that believes it is vital to include and engage diverse people  perspectives and ideas to achieve our best    What You Will Do  Responsible for Morocco   Algeria day to day administration of policies  processes and programs covering several or all the following  recruiting  payroll  onboarding  offboarding  compensation and benefits  coaching  employee performance  legal and labor relations  Manage employee lifecycle activities including contracts  promotion or pay changes  disciplinary and exits  Provide forward thinking HR consultation on operational and process issues impacting the business and take forward suggested HR proposals for review and implementation Coach and develop managers around employee relations  performance management  goal setting and other key areas  Ensure all related processes defined from global HR are effectively executed within timeline  Identify and implement opportunities for improvement of core HR service delivery Assist associates with inquiries  concerns   needs  Act as an impartial advocate for fair   equitable treatment  Create and recommend opportunities to enhance the culture and associate engagement  Serve as a resource to both managers and associates by providing policy  systems  and procedure interpretation  Support the review   development of HR policies and processes as necessary for the business  Mitigate organizational risk by ensuring compliance with all employment laws  Partner with hiring managers and HR business partners to develop effective marketplace recruitment strategies and ensure the organization s recruiting needs are handled appropriately  Source candidates through multiple channels and conduct interviews to identify qualified candidates and partner with managers throughout the staffing process  Support effective on boarding of new hires and effective integration into the business as led by the Line Manager  Provide HR related data and reporting to leaders in order to promote data driven decision making and strategy development  Support actions of the wider HR team including related projects and regional HR initiatives  Perform other duties as needed and as assigned by line Manager      Requirements   Degree in Human Resources  Industrial Relations or Business with three to five years of human resource experience  Must be English  French and Arabic speaking   Location  Job is located in Casablanca with a requirement to travel when needed   Our Commitment to Diversity and Inclusion  Ecolab is committed to fair and equal treatment of associates and applicants and furthering the principles of Equal Opportunity to Employment  Our goal is to fully utilize minority  female  and disabled individuals at all levels of the workforce  We will recruit  hire  promote  transfer and provide opportunities for advancement based on individual qualifications and job performance  In all matters affecting employment  compensation  benefits  working conditions  and opportunities for advancement  Ecolab will not discriminate against any associate or applicant for employment because of race  religion  color  creed  national origin  citizenship status  sex  sexual orientation  gender identity and expressions  genetic information  marital status  age  or disability 
