Job Title,Company,Link,Description
SrChef-Banquet - job post,"Marriott International, Inc",Additional Information Job Number24183631 Job CategoryFood and Beverage   Culinary LocationRabat Marriott Hotel  Avenue Inaouin  Arribat Center Agdal  Rabat  Morocco  Morocco  10000 ScheduleFull Time Located Remotely N Position Type Management      JOB SUMMARY  Exhibits culinary talents by personally performing tasks while leading the banquet food preparation staff and managing all food related catering functions  Accountable for coordinating menus  purchasing  scheduling  food preparation and plating for catering events  The individual is responsible for delivering a consistent  high quality product with an appetizing presentation  Works to continually improve guest and employee satisfaction while maintaining the operating budget  Must ensure sanitation and food standards are achieved   CANDIDATE PROFILE  Education and Experience  High school diploma or GED  4 years experience in the culinary  food and beverage  or related professional area   OR  2 year degree from an accredited university in Culinary Arts  Hotel and Restaurant Management  or related major  2 years experience in the culinary  food and beverage  or related professional area    CORE WORK ACTIVITIES  Leading Banquet Culinary Teams  Supervises and coordinates activities of cooks and workers engaged in food preparation for property banquets and events    Utilizes interpersonal and communication skills to lead  influence  and encourage others  advocates sound financial business decision making  demonstrates honesty integrity  leads by example    Supervises and manages employees  Managing all day to day operations  Understanding employee positions well enough to perform duties in employees  absence    Encourages and builds mutual trust  respect  and cooperation among team members    Serves as a role model to demonstrate appropriate behaviors    Ensures and maintains the productivity level of employees    Supervises banquet kitchen shift operations    Establishes and maintains open  collaborative relationships with employees and ensures employees do the same within the team    Leads shifts while personally preparing food items and executing requests based on required specifications    Ensuring Culinary Standards and Responsibilities are Met for Banquet Events  Estimates daily Banquet Event Order production needs    Coordinates banquet production and plating with the Executive Chef  Sous Chef and Banquet Maitre d    Recognizes superior quality products  presentations and flavor    Plans and manages food quantities and plating requirements for all banquet functions    Maintains food preparation handling and correct storage standards    Ensures compliance with all Food   Beverage policies  standards and procedures    Assists the Executive Chef and Purchasing Manager with banquet menu planning and food purchasing    Develops banquet  seasonal and specialty menus for catering customers    Knows and implements brand s Safety Standards    Ensures compliance with all applicable laws and regulations    Follows proper handling and right temperature of all food products    Prepares and cooks foods of all types  either on a regular basis or for special guests or functions    Checks the quality of raw and cooked food products to ensure that standards are met    Assists in determining how food should be presented and creates decorative food displays    Ensuring Exceptional Customer Service  Provides services that are above and beyond for customer satisfaction and retention    Manages day to day operations  ensuring the quality  standards and meeting the expectations of the customers on a daily basis    Improves service by communicating and assisting individuals to understand guest needs  providing guidance  feedback  and individual coaching when needed    Strives to improve service performance    Sets a positive example for guest relations    Empowers employees to provide excellent customer service    Maintaining Culinary Goals Associated with Banquet Events  Sets and supports achievement of goals including performance goals  budget goals  team goals  etc    Develops specific goals and plans to prioritize  organize  and accomplish your work    Understands the impact of departments operation on the overall property financial goals and objectives and manages to achieve or exceed budgeted goals    Supports procedures for food   beverage portion and waste controls    Managing and Conducting Human Resource Activities  Identifies the developmental needs of others and coaching  mentoring  or otherwise helping others to improve their knowledge or skills    Identifies the educational needs of others  developing formal educational or training programs or classes  and teaching or instructing others    Participates in employee progress discipline procedures    Participates in training staff on menu items including ingredients  preparation methods and unique tastes    Reviews staffing levels to ensure that guest service  operational needs and financial objectives are met    Ensures disciplinary procedures and documentation are completed according to Standard and Local Operating Procedures  SOPs and LSOPs  and support the Peer Review Process    Assists as needed in the interviewing and hiring of employee team members with appropriate skills    Additional Responsibilities  Provides information to supervisors  co workers  and subordinates by telephone  in written form  e mail  or in person    Analyzes information and evaluating results to choose the best solution and solve problems    Attends daily Banquet Event meetings to review culinary requirements    Attends and participates in all pertinent meetings        Marriott International is an equal opportunity employer  We believe in hiring a diverse workforce and sustaining an inclusive  people first culture  We are committed to non discrimination on any protected basis  such as disability or any other basis covered under applicable law   Marriott Hotels strive to elevate the art of hospitality  innovating at every opportunity while keeping the comfort of the oh so familiar all around the globe  As a host with Marriott Hotels  you will help keep the promise of  Wonderful Hospitality  Always   by delivering thoughtful  heartfelt  forward thinking service that upholds and builds upon this living legacy  With the name that s synonymous with hospitality the world over  we are proud to welcome you to explore a career with Marriott Hotels  In joining Marriott Hotels  you join a portfolio of brands with Marriott International  Be where you can do your best work  begin your purpose  belong to an amazing global team  and become the best version of you        JW Marriott is part of Marriott International s luxury portfolio and consists of more than 100 beautiful properties in gateway cities and distinctive resort locations around the world  JW believes our associates come first  Because if you re happy  our guests will be happy  JW Marriott associates are confident  innovative  genuine  intuitive  and carry on the legacy of the brand s namesake and company founder  J Willard Marriott  Our hotels offer a work experience unlike any other  where you ll be part of a community and enjoy true camaraderie with a diverse group of co workers  JW creates opportunities for training  development  recognition and most importantly  a place where you can pursue your passions in a luxury environment with a focus on holistic well being  Treating guests exceptionally starts with the way we take care of our associates  That s The JW Treatment   In joining JW Marriott  you join a portfolio of brands with Marriott International  Be where you can do your best work  begin your purpose  belong to an amazing global team  and become the best version of you 
Dir-Food & Beverage-C - job post,"Marriott International, Inc",Additional Information Job Number24194984 Job CategoryFood and Beverage   Culinary LocationThe Ritz Carlton Rabat Dar Es Salam  KM 9 Avenue Mohammed VI  Rabat  Morocco  Morocco  BP 10170 ScheduleFull Time Located Remotely N Position Type Management      JOB SUMMARY  Functions as the strategic business leader of the property s food and beverage culinary operation  including Restaurants Bars  Room Service and Banquets Catering  where applicable  Position oversees the development and implementation of departmental strategies and ensures implementation of the brand service strategy and brand initiatives  The position ensures the food and beverage culinary operation meets the brand s target customer needs  ensures employee satisfaction  and focuses on growing revenues and maximizing the financial performance of the department  Develops and implements property wide strategies that deliver products and services to meet or exceed the needs and expectations of the brand s target customer and property employees and provides a return on investment   CANDIDATE PROFILE  Education and Experience  High school diploma or GED  6 years experience in the food and beverage  culinary  event management  or related professional area   OR  2 year degree from an accredited university in Food Service Management  Hotel and Restaurant Management  Hospitality  Business Administration  or related major  4 years experience in the food and beverage  culinary  event management  or related professional area    Skills and Knowledge  Customer and Personal Service   Knowledge of principles and processes for providing customer and personal services  This includes customer needs assessment  meeting quality standards for services  and evaluation of customer satisfaction    Management of Financial Resources   Determining how money will be spent to get the work done  and accounting for these expenditures    Administration and Management   Knowledge of business and management principles involved in strategic planning  resource allocation  human resources modeling  leadership technique  production methods  and coordination of people and resources    Applied Business Knowledge   Understanding market dynamics  enterprise level objectives and important aspects of the company s business to accurately diagnose strengths and weaknesses  anticipate opportunities and risks  identify issues  and develop strategies and plans  Aligning individual and team actions with strategies and plans to drive business results    Management of Material Resources   Obtaining and seeing to the appropriate use of equipment  facilities  and materials needed to do certain work    CORE WORK ACTIVITIES  Developing and Maintaining Food and Beverage Culinary Goals  Sets expectations and holds food and beverage leadership team accountable for demonstrating desired service behaviors    Reviews financial reports and statements to determine how Food and Beverage is performing against budget    Makes recommendations for CAPEX funding of food and beverage equipment and renovations in accordance with brand business strategy    Works with food and beverage leadership team to determine areas of concern and develops strategies to improve the department s financial performance    Establishes challenging  realistic and obtainable goals to guide operation and performance    Strives to improve service performance    Developing and Maintaining Budgets  Develops and manages Food and Beverage budget    Monitors the department s actual and projected sales to ensure revenue goals are met or exceeded and opportunities are identified and addressed    Ensures cash control and liquor control policies are in place in food   beverage areas and followed by all related employees    Focuses on maintaining profit margins without compromising guest or employee satisfaction    Leading Food and Beverage Culinary Team  Utilizes interpersonal and communication skills to lead  influence  and encourage others  advocates sound financial business decision making  demonstrates honesty integrity  leads by example    Encourages and builds mutual trust  respect  and cooperation among team members    Achieves and exceeds goals including performance goals  budget goals  team goals  etc    Serves as a role model to demonstrate appropriate behaviors    Develops means to improve profit  including estimating cost and benefit  exploring new business opportunities  etc    Identifies opportunities to increase profits and create value by challenging existing processes  encouraging innovation and driving necessary change    Ensures that regular  on going communication occurs in all areas of food and beverage  e g   pre meal briefings  staff meetings  culinary team     Establishes and maintains open  collaborative relationships with direct reports and entire food   beverage team  Ensures direct reports do the same for their team    Develops a food and beverage operating strategy that is aligned with the brand s business strategy and leads its execution    Identifies the developmental needs of others and coaches  mentors  or otherwise helps others to improve their knowledge or skills    Stays aware of market trends and introduces new food and beverage products to meet or exceed customer expectations  generate increased revenue and ensure a competitive position in the market    Ensuring Exceptional Customer Service  Provides services that are above and beyond for customer satisfaction and retention    Improves service by communicating and assisting individuals to understand guest needs  providing guidance  feedback  and individual coaching when needed    Reviews findings from comment cards and guest satisfaction results with F  B team and ensures appropriate corrective action is taken    Reviews comment cards  guest satisfaction results and other data to identify areas of improvement    Empowers employees to provide excellent guest service    Estimates cost and benefit ratio  maintaining balance between profit and service satisfaction    Shares plans to take corrective action based on comment cards and guest satisfaction results with property leadership    Managing and Conducting Human Resource Activities  Provides guidance and direction to subordinates  including setting performance standards and monitoring performance    Coaches and supports food   beverage leadership team to effectively manage wages  food   beverage cost and controllable expenses  e g   restaurant supplies  uniforms  etc      Hires food   beverage leadership team members who demonstrate strong functional expertise  creativity and entrepreneurial leadership to meet the business needs of the operation    Sets goals and expectations for direct reports using the performance review process and holds staff accountable for successful performance    Ensures that expectations and objectives are clearly communicated to subordinates  subordinates are also open to raise questions and or concerns    Brings issues to the attention of Human Resources as necessary    Ensures employees are treated fairly and equitably    Coaches team by providing specific feedback to improve performance    Additional Responsibilities  Informs and or update the executives  the peers and the subordinates on relevant information in a timely manner    Provides information to supervisors  co workers  and subordinates by telephone  in written form  e mail  or in person    Analyzes information and evaluating results to choose the best solution and solve problems    Estimate food  liquor  wine  and other beverage consumption in order to anticipate amounts to be purchased or requisitioned    Order and purchase equipment and supplies        Marriott International is an equal opportunity employer  We believe in hiring a diverse workforce and sustaining an inclusive  people first culture  We are committed to non discrimination on any protected basis  such as disability and veteran status  or any other basis covered under applicable law   At more than 100 award winning properties worldwide  The Ritz Carlton Ladies and Gentlemen create experiences so exceptional that long after a guest stays with us  the experience stays with them  Attracting the world s top hospitality professionals who curate lifelong memories  we believe that everyone succeeds when they are empowered to be creative  thoughtful and compassionate   Every day  we set the standard for rare and special luxury service the world over and pride ourselves on delivering excellence in the care and comfort of our guests      Your role will be to ensure that the  Gold Standards  of The Ritz Carlton are delivered graciously and thoughtfully every day  The Gold Standards are the foundation of The Ritz Carlton and are what guides us each day to be better than the next  It is this foundation and our belief that our culture drives success by which The Ritz Carlton has earned the reputation as a global brand leader in luxury hospitality  As part of our team  you will learn and exemplify the Gold Standards  such as our Employee Promise  Credo and our Service Values  And our promise to you is that we offer the chance to be proud of the work you do and who you work with      In joining The Ritz Carlton  you join a portfolio of brands with Marriott International  Be where you can do your best work  begin your purpose  belong to an amazing global team  and become the best version of you 
PowerBuilder Engineer - job post,Sightview Software,At Sightview Software LLC  we re dedicated to equipping clinicians with innovative  secure technology  enabling them to focus on delivering life changing care to every patient  By joining our team  you ll be at the heart of this mission  helping us continuously improve our offerings to enhance the experiences of both patients and practices       We are a remote first company with no physical offices  allowing our employees the flexibility to work from anywhere  Every Sightview Software employee is part of a global community  where a vital support network ensures everyone feels heard and valued  Our team is driven by core values  Customer Centricity  Excellence in Execution  and Teamwork       We believe that our work has a profound impact on society  Better eye care leads to a healthier  happier population  and our values keep us aligned with this larger vision       Job Description      We are seeking an experienced PowerBuilder Engineer to join our dynamic team  The ideal candidate will possess a problem solving mindset  a strong background in working with cloud environments  preferably AWS   and the ability to lead the team through the process of upgrading legacy code  This role requires exceptional skills in development practices  object oriented programming  and flexibility to adapt to the changing needs of projects    Responsibilities  Responsible for development  maintenance and support the application written in PowerBuilder 2022 and  NET with SQL Server as backend Develop and fix the database issues by writing modifying store procedures  triggers and functions Contributing to regular code review and providing feedback to peer team members Following the Development lifecycle as per the organizational guidelines Implement and advocate for best practices in testing  code review and technical design Apply advanced OOP principles to design robust software solutions Ensure code is modular  efficient  and maintainable  Mentor junior developers on OOP best practices and principles Gather requirements and information from stakeholders on the development tasks Should be able to work in a dynamic environment with changing priority and assignments Refactoring code for better code quality and application performance Active participation and engagement with peer team members and stakeholders in meetings   Requirements  Minimum of 5 years of experience in PowerBuilder 12 5 and 2019 or above Minimum of 5 years of experience in databases like MS SQL Server Demonstrated ability to manage and upgrade legacy systems Experience with PowerBuilder Foundation Classes  PFC  Experience writing Store Procedures  Triggers  functions and complex queries is must Exceptional skills in development practices  including testing  code review and CI CD Advanced knowledge of object oriented programming  OOP  Preferred previous experience with HL7 and FHIR Preferred experience working on  NET development     Global Benefits at Sightview Software LLC      We believe that healthy and happy employees are more productive and better equipped to serve our customers  With this in mind  we offer a generous benefits package to all employees       From flexible schedules and paid time off to comprehensive health and retirement plans  our benefits are designed to support your well being  Specific benefits vary by country and can be discussed with our HR team       Apply Now      Become a part of our mission to transform eye care and improve lives  Apply today and help us make a difference 
